{
  "text_id": "reg_071",
  "title": "Татарстан: образования и молодежных инициатив и публичной дискуссии в региональной повестке 2026-071",
  "author": null,
  "source": "Бизнес Online",
  "source_type": "regional_media",
  "publication_date": "2026-04-22",
  "year": 2026,
  "url": "https://www.business-gazeta.ru/corpus/regional/reg_071",
  "access_date": "2026-06-01",
  "archive_link": null,
  "segment": "regional",
  "genre": "other",
  "speed_layer": "medium",
  "region": "Татарстан",
  "audience_type": null,
  "topics": [
    "regional_development",
    "education_and_science"
  ],
  "selection_reason": "Материал из раздела «Региональные медиа», содержит концепт «БУДУЩЕЕ», фрейм «локальная мобильность» и модель действия «создание возможностей», значимые для реконструкции медиакультурной модели мира.",
  "excerpt": null,
  "summary": null,
  "legal": {
    "license_status": "metadata_only",
    "full_text_stored": false,
    "notes": "В репозитории хранится карточка, ссылка, метаданные и разметка. Полный текст не размещается."
  },
  "annotation_status": "assisted_draft",
  "annotation": {
    "concepts": [
      {
        "value": "БУДУЩЕЕ",
        "rank": "primary",
        "evidence": null
      }
    ],
    "frames": [
      {
        "value": "локальная мобильность",
        "rank": "primary",
        "evidence": null
      }
    ],
    "metaphors": [
      {
        "value": "город как стартовая площадка",
        "rank": "primary",
        "evidence": null
      }
    ],
    "value_oppositions": [
      {
        "value": "возможность / отток",
        "rank": "primary",
        "evidence": null
      }
    ],
    "subject_roles": [
      {
        "value": "молодежь / регион",
        "rank": "primary",
        "evidence": null
      }
    ],
    "action_model": "создание возможностей",
    "norm_model": "регион должен удерживать человеческий потенциал",
    "threat_model": "миграционный отток",
    "temporality": [
      "future_projection"
    ],
    "cultural_references": [],
    "literary_references": [],
    "world_model_dimension": [
      "region",
      "future"
    ],
    "uncertainty_notes": null
  }
}
