{
  "text_id": "opin_060",
  "title": "Будущем труда в повестке международной повестки: авторская колонка 2023-060",
  "author": null,
  "source": "Бизнес Online",
  "source_type": "regional_media",
  "publication_date": "2023-01-01",
  "year": 2023,
  "url": "https://www.business-gazeta.ru/corpus/opinion/opin_060",
  "access_date": "2026-06-01",
  "archive_link": null,
  "segment": "opinion",
  "genre": "column",
  "speed_layer": "medium",
  "region": null,
  "audience_type": null,
  "topics": [
    "economy_and_labor",
    "technologies"
  ],
  "selection_reason": "Материал из раздела «Колонки и публицистика», содержит концепт «ТРУД», фрейм «человек в экономике» и модель действия «переоценка навыков», значимые для реконструкции медиакультурной модели мира.",
  "excerpt": null,
  "summary": null,
  "legal": {
    "license_status": "metadata_only",
    "full_text_stored": false,
    "notes": "В репозитории хранится карточка, ссылка, метаданные и разметка. Полный текст не размещается."
  },
  "annotation_status": "assisted_draft",
  "annotation": {
    "concepts": [
      {
        "value": "ТРУД",
        "rank": "primary",
        "evidence": null
      }
    ],
    "frames": [
      {
        "value": "человек в экономике",
        "rank": "primary",
        "evidence": null
      }
    ],
    "metaphors": [
      {
        "value": "профессия как маршрут",
        "rank": "primary",
        "evidence": null
      }
    ],
    "value_oppositions": [
      {
        "value": "достоинство труда / вытеснение",
        "rank": "primary",
        "evidence": null
      }
    ],
    "subject_roles": [
      {
        "value": "работник / технология",
        "rank": "primary",
        "evidence": null
      }
    ],
    "action_model": "переоценка навыков",
    "norm_model": "технологии должны усиливать, а не обесценивать человека",
    "threat_model": "утрата профессиональной субъектности",
    "temporality": [
      "future_projection"
    ],
    "cultural_references": [],
    "literary_references": [],
    "world_model_dimension": [
      "economy",
      "anthropology"
    ],
    "uncertainty_notes": null
  }
}
