{
  "text_id": "analyt_106",
  "title": "Как цифровая трансформация меняет модель транспортной системы: аналитический разбор 2025-106",
  "author": null,
  "source": "Forbes Russia",
  "source_type": "business_media",
  "publication_date": "2025-07-15",
  "year": 2025,
  "url": "https://www.forbes.ru/corpus/analytics/analyt_106",
  "access_date": "2026-06-01",
  "archive_link": null,
  "segment": "analytics",
  "genre": "analysis",
  "speed_layer": "medium",
  "region": null,
  "audience_type": null,
  "topics": [
    "technologies",
    "economy_and_labor"
  ],
  "selection_reason": "Материал из раздела «Аналитика», содержит концепт «ДАННЫЕ», фрейм «конкуренция за ресурсы» и модель действия «управление ресурсами», значимые для реконструкции медиакультурной модели мира.",
  "excerpt": null,
  "summary": null,
  "legal": {
    "license_status": "metadata_only",
    "full_text_stored": false,
    "notes": "В репозитории хранится карточка, ссылка, метаданные и разметка. Полный текст не размещается."
  },
  "annotation_status": "assisted_draft",
  "annotation": {
    "concepts": [
      {
        "value": "ДАННЫЕ",
        "rank": "primary",
        "evidence": null
      }
    ],
    "frames": [
      {
        "value": "конкуренция за ресурсы",
        "rank": "primary",
        "evidence": null
      }
    ],
    "metaphors": [
      {
        "value": "данные как нефть",
        "rank": "primary",
        "evidence": null
      }
    ],
    "value_oppositions": [
      {
        "value": "доступность / монополизация",
        "rank": "primary",
        "evidence": null
      }
    ],
    "subject_roles": [
      {
        "value": "корпорация / общество",
        "rank": "primary",
        "evidence": null
      }
    ],
    "action_model": "управление ресурсами",
    "norm_model": "технологическое развитие требует общественного контроля",
    "threat_model": "монополизация данных",
    "temporality": [
      "future_projection"
    ],
    "cultural_references": [],
    "literary_references": [],
    "world_model_dimension": [
      "technology",
      "economy"
    ],
    "uncertainty_notes": null
  }
}
