{
  "text_id": "analyt_088",
  "title": "Как образовательная политика меняет модель школьной программы: аналитический разбор 2023-088",
  "author": null,
  "source": "Россия в глобальной политике",
  "source_type": "business_media",
  "publication_date": "2023-01-01",
  "year": 2023,
  "url": "https://globalaffairs.ru/corpus/analytics/analyt_088",
  "access_date": "2026-06-01",
  "archive_link": null,
  "segment": "analytics",
  "genre": "analysis",
  "speed_layer": "medium",
  "region": null,
  "audience_type": null,
  "topics": [
    "education_and_science",
    "future_models"
  ],
  "selection_reason": "Материал из раздела «Аналитика», содержит концепт «КОМПЕТЕНЦИИ», фрейм «подготовка будущего» и модель действия «переобучение», значимые для реконструкции медиакультурной модели мира.",
  "excerpt": null,
  "summary": null,
  "legal": {
    "license_status": "metadata_only",
    "full_text_stored": false,
    "notes": "В репозитории хранится карточка, ссылка, метаданные и разметка. Полный текст не размещается."
  },
  "annotation_status": "assisted_draft",
  "annotation": {
    "concepts": [
      {
        "value": "КОМПЕТЕНЦИИ",
        "rank": "primary",
        "evidence": null
      }
    ],
    "frames": [
      {
        "value": "подготовка будущего",
        "rank": "primary",
        "evidence": null
      }
    ],
    "metaphors": [
      {
        "value": "школа как лаборатория будущего",
        "rank": "primary",
        "evidence": null
      }
    ],
    "value_oppositions": [
      {
        "value": "обновление / инерция",
        "rank": "primary",
        "evidence": null
      }
    ],
    "subject_roles": [
      {
        "value": "учитель / ученик",
        "rank": "primary",
        "evidence": null
      }
    ],
    "action_model": "переобучение",
    "norm_model": "образование должно отвечать изменению среды",
    "threat_model": "дефицит навыков",
    "temporality": [
      "future_projection"
    ],
    "cultural_references": [],
    "literary_references": [],
    "world_model_dimension": [
      "knowledge",
      "future"
    ],
    "uncertainty_notes": null
  }
}
