{
  "text_id": "popsci_094",
  "title": "Что известно о космических исследований для правового регулирования: научно-популярный разбор 2025-094",
  "author": null,
  "source": "Элементы",
  "source_type": "science_media",
  "publication_date": "2025-07-15",
  "year": 2025,
  "url": "https://elementy.ru/corpus/popular_science/popsci_094",
  "access_date": "2026-06-01",
  "archive_link": null,
  "segment": "popular_science",
  "genre": "popular_science_article",
  "speed_layer": "long",
  "region": null,
  "audience_type": null,
  "topics": [
    "education_and_science",
    "future_models"
  ],
  "selection_reason": "Материал из раздела «Научно-популярные и технологические тексты», содержит концепт «ПОЗНАНИЕ», фрейм «расширение горизонта» и модель действия «исследование», значимые для реконструкции медиакультурной модели мира.",
  "excerpt": null,
  "summary": null,
  "legal": {
    "license_status": "metadata_only",
    "full_text_stored": false,
    "notes": "В репозитории хранится карточка, ссылка, метаданные и разметка. Полный текст не размещается."
  },
  "annotation_status": "assisted_draft",
  "annotation": {
    "concepts": [
      {
        "value": "ПОЗНАНИЕ",
        "rank": "primary",
        "evidence": null
      }
    ],
    "frames": [
      {
        "value": "расширение горизонта",
        "rank": "primary",
        "evidence": null
      }
    ],
    "metaphors": [
      {
        "value": "космос как лаборатория",
        "rank": "primary",
        "evidence": null
      }
    ],
    "value_oppositions": [
      {
        "value": "открытие / неизвестность",
        "rank": "primary",
        "evidence": null
      }
    ],
    "subject_roles": [
      {
        "value": "исследователь / человечество",
        "rank": "primary",
        "evidence": null
      }
    ],
    "action_model": "исследование",
    "norm_model": "наука расширяет границы коллективного знания",
    "threat_model": "технологическая неопределенность",
    "temporality": [
      "future_projection"
    ],
    "cultural_references": [],
    "literary_references": [],
    "world_model_dimension": [
      "knowledge",
      "future"
    ],
    "uncertainty_notes": null
  }
}
