{
  "text_id": "news_192",
  "title": "RT: новая повестка о семейной и демографической политике в контексте малого бизнеса, 2023",
  "author": null,
  "source": "RT",
  "source_type": "federal_media",
  "publication_date": "2023-01-01",
  "year": 2023,
  "url": "https://russian.rt.com/corpus/news/news_192",
  "access_date": "2026-06-01",
  "archive_link": null,
  "segment": "news",
  "genre": "news",
  "speed_layer": "fast",
  "region": null,
  "audience_type": null,
  "topics": [
    "family_and_demography",
    "state_and_society"
  ],
  "selection_reason": "Материал из раздела «Новости», содержит концепт «СЕМЬЯ», фрейм «социальная поддержка» и модель действия «поддержка», значимые для реконструкции медиакультурной модели мира.",
  "excerpt": null,
  "summary": null,
  "legal": {
    "license_status": "metadata_only",
    "full_text_stored": false,
    "notes": "В репозитории хранится карточка, ссылка, метаданные и разметка. Полный текст не размещается."
  },
  "annotation_status": "assisted_draft",
  "annotation": {
    "concepts": [
      {
        "value": "СЕМЬЯ",
        "rank": "primary",
        "evidence": null
      }
    ],
    "frames": [
      {
        "value": "социальная поддержка",
        "rank": "primary",
        "evidence": null
      }
    ],
    "metaphors": [
      {
        "value": "семья как опора",
        "rank": "primary",
        "evidence": null
      }
    ],
    "value_oppositions": [
      {
        "value": "забота / распад связей",
        "rank": "primary",
        "evidence": null
      }
    ],
    "subject_roles": [
      {
        "value": "семья / государство",
        "rank": "primary",
        "evidence": null
      }
    ],
    "action_model": "поддержка",
    "norm_model": "социальная политика должна укреплять доверие и устойчивость",
    "threat_model": "демографическая уязвимость",
    "temporality": [
      "future_projection"
    ],
    "cultural_references": [],
    "literary_references": [],
    "world_model_dimension": [
      "family",
      "society"
    ],
    "uncertainty_notes": null
  }
}
